{
  "protocol": 1,
  "server_time": 1761096000,
  "next_wake_s": 1800,
  "full_refresh": false,
  "panel": { "w": 800, "h": 480, "dpi": 124, "depth": 1 },
  "current": "detail",
  "views": [
    { "id": "todo", "hash": "9f2c1a7b", "format": "raw1", "bytes": 48000, "crc32": "3a1f09c4" },
    {
      "id": "detail",
      "hash": "41d0e2aa",
      "format": "raw1",
      "bytes": 48000,
      "crc32": "b7e2d150",
      "parent": "todo"
    }
  ]
}
